{
  "question_id": "MA-Q-0003",
  "family_id": "CII_PARTIAL_FILL_PATIENT_REQUEST",
  "area": 3,
  "topic": "Partial filling",
  "subtopic": "Schedule II remainder",
  "difficulty": 4,
  "question_type": "SBA",
  "provenance": "GEN",
  "stem": "A Massachusetts pharmacy partially dispenses a methylphenidate prescription at the patient's request. On day 20 after issue, the patient asks a different pharmacy to dispense the remainder. What is the best response?",
  "choices": [
    {"id": "A", "text": "Transfer the balance as a refill because fewer than 30 days have passed."},
    {"id": "B", "text": "Decline to dispense the balance there because the remainder belongs to the original pharmacy's partial-fill record."},
    {"id": "C", "text": "Wait until day 31, when the remainder automatically becomes a new prescription."},
    {"id": "D", "text": "Convert methylphenidate to Schedule III and transfer the balance."}
  ],
  "correct_choice_ids": ["B"],
  "allow_zero_correct": false,
  "explanation": {
    "core_reasoning": "The patient-requested Schedule II remainder is not a refill. Massachusetts ties completion of that remainder to the pharmacy that made the original partial dispensing and to the statutory deadline.",
    "choice_analysis": {
      "A": "A Schedule II partial-fill balance is not transformed into a transferable refill by the passage of fewer than 30 days.",
      "B": "This is correct because a different pharmacy cannot take over the original pharmacy's patient-requested remainder.",
      "C": "The unfilled balance does not become a new prescription after the remainder deadline.",
      "D": "A pharmacist cannot change methylphenidate's Schedule II classification to permit a transfer."
    },
    "related_facts": [
      "Methylphenidate is a nonnarcotic Schedule II stimulant.",
      "Different Schedule II partial-fill pathways have different predicates and must be analyzed separately."
    ],
    "mpje_trap": "Importing a refill-transfer concept into a Schedule II partial-fill remainder."
  },
  "rule_ids": ["MA-CII-PARTIAL-PATIENT", "FED-CS-SCHEDULES"],
  "drug_ids": ["methylphenidate"],
  "reasoning_steps": [
    "Identify methylphenidate as Schedule II",
    "Distinguish a partial-fill remainder from a refill"
  ],
  "verification_status": "AUDIT_PENDING",
  "lifecycle_status": "AUDIT_PENDING",
  "last_legal_review": "2026-08-13",
  "audits": [],
  "duplicate_review_status": "PENDING",
  "independent_audit_status": "PENDING",
  "final_adjudication": null,
  "development_fixture": true
}

